{
  "schemaVersion": 1,
  "eventId": "0d5e6f7a-8b9c-4d0e-9f1a-3b4c5d6e7f8a",
  "branchCode": "BR0001",
  "businessDate": "2026-10-01",
  "terminalId": "POS02",
  "shiftNo": 1,
  "revision": 1,
  "confirmedAt": "2026-10-01T15:02:11+07:00",
  "openedAt": "2026-10-01T07:00:00+07:00",
  "closedAt": "2026-10-01T15:02:11+07:00",
  "transactionCount": 212,
  "currency": "THB",
  "totalAmount": "18450.00",
  "cashExpected": "9120.00",
  "cashCounted": "9100.00",
  "lines": [
    { "tenderType": "CASH", "amount": "9120.00", "quantity": 140 },
    { "tenderType": "CREDIT_CARD", "amount": "6230.00", "quantity": 48 },
    { "tenderType": "QR_PAYMENT", "amount": "3100.00", "quantity": 24 }
  ]
}
